{"report_id":"ethos-2026-01-30-424b4-v0.1","report_version":"0.1.0","methodology_version":"0.1","status":"draft","supersedes_report_id":null,"issuer":{"legal_name":"Ethos Technologies Inc.","brand_name":"Ethos","country":"United States","industry":"Technology-enabled life insurance distribution, underwriting administration, and policy administration","website":null},"offering_state":{"exchange":"Nasdaq Global Select Market","ticker":"LIFE","filing_type":"424B4","filing_version":"Final prospectus dated 2026-01-28, filed 2026-01-30","filing_published_at":"2026-01-30T00:00:00Z","filing_url":"https://www.sec.gov/Archives/edgar/data/1788451/000119312526029993/d901135d424b4.htm","source_accessed_at":"2026-07-21T09:30:00Z","expected_offering_date":"2026-01-30","price_range_low":19.0,"price_range_high":19.0,"currency":"USD","primary_shares":5127696,"secondary_shares":5398619},"dimensions":[{"id":"revenue_durability","name":"Revenue growth and durability","status":"scored","max_points":15,"earned_points":11,"confidence":"medium","evidence_ids":["EV-002","EV-005"],"assumptions":[],"judgment":"Growth is exceptional, but 98% carrier concentration and persistency-estimate sensitivity materially reduce durability."},{"id":"profitability_cash_flow","name":"Profitability and cash flow","status":"scored","max_points":15,"earned_points":10,"confidence":"medium","evidence_ids":["EV-002","EV-003"],"assumptions":[],"judgment":"GAAP income and Adjusted EBITDA are strong, but 2024 operating cash flow was negative and working-capital conversion remains important."},{"id":"market_competition","name":"Market and competitive position","status":"scored","max_points":10,"earned_points":8,"confidence":"medium","evidence_ids":["EV-004","EV-005"],"assumptions":["No independent market-share benchmark is included."],"judgment":"The asset-light platform, carrier integrations, agent network, and data loop are attractive, offset by concentrated counterparties and intense regulated competition."},{"id":"valuation_quality","name":"Valuation quality","status":"scored","max_points":15,"earned_points":8,"confidence":"medium","evidence_ids":["EV-007"],"assumptions":["Outstanding awards are included at full share count; future plan reserves are excluded from current fully diluted equity value.","The 27.813 million dollar commission-receivable financing liability is treated as debt-like.","Nine-month 2025 revenue and Adjusted EBITDA are annualized without seasonality adjustment."],"judgment":"The offering implies moderate growth multiples for a profitable platform, but no independent peer set is included and estimate-sensitive revenue warrants a discount."},{"id":"balance_sheet","name":"Debt and balance-sheet resilience","status":"scored","max_points":10,"earned_points":9,"confidence":"high","evidence_ids":["EV-003","EV-004","EV-007"],"assumptions":[],"judgment":"Ethos has substantial cash and investments, limited debt-like financing, and does not retain insurance-policy balance-sheet risk."},{"id":"use_of_proceeds","name":"Use of proceeds","status":"scored","max_points":10,"earned_points":4,"confidence":"high","evidence_ids":["EV-001","EV-006"],"assumptions":[],"judgment":"More than half the offered shares are secondary and about 59% of company net proceeds fund RSU-related tax withholding, leaving a relatively small broadly defined operating pool."},{"id":"insiders_lockup_dilution","name":"Insider selling, lock-up, and dilution","status":"scored","max_points":10,"earned_points":4,"confidence":"high","evidence_ids":["EV-001","EV-008"],"assumptions":[],"judgment":"Secondary selling exceeds primary issuance, immediate tangible-book dilution is high, and outstanding awards plus large future plan reserves create meaningful overhang despite lock-up protection."},{"id":"governance_rights","name":"Governance and shareholder rights","status":"scored","max_points":5,"earned_points":1,"confidence":"high","evidence_ids":["EV-009"],"assumptions":[],"judgment":"Twenty-vote Class B shares give founders and two venture investors overwhelming voting influence while public Class A investors receive one vote per share."},{"id":"legal_regulatory","name":"Legal and regulatory risk","status":"scored","max_points":5,"earned_points":3,"confidence":"medium","evidence_ids":["EV-010"],"assumptions":["No independent litigation, licensing, or enforcement-database review is included."],"judgment":"No material litigation is disclosed, but insurance distribution, agent conduct, compensation, privacy, licensing, and underwriting administration create material regulatory exposure."},{"id":"disclosure_quality","name":"Disclosure quality and consistency","status":"scored","max_points":5,"earned_points":3,"confidence":"medium","evidence_ids":["EV-005","EV-011"],"assumptions":[],"judgment":"The filing is detailed about estimates and concentration, but the unresolved material weakness and complex revenue recognition reduce confidence."}],"score_summary":{"earned_points":61,"applicable_max_points":100,"normalized_score":61.0,"coverage_percent":100.0,"interpretation_band":"meaningful_risks"},"overall_confidence":"medium","red_flags":[{"title":"Carrier concentration is extreme","severity":"high","evidence_ids":["EV-005"],"explanation":"The top three carrier relationships represented about 98% of revenue in both 2023 and 2024."},{"title":"Offering provides substantial existing-holder liquidity","severity":"high","evidence_ids":["EV-001","EV-006"],"explanation":"Selling stockholders offer more shares than the company, and Ethos receives no proceeds from the secondary component."},{"title":"Dual-class voting concentrates control","severity":"high","evidence_ids":["EV-009"],"explanation":"Class B has 20 votes per share; founders hold about 38.5% of voting power and Accel plus Sequoia about 57.0%."},{"title":"Internal-control material weakness remains unresolved","severity":"high","evidence_ids":["EV-011"],"explanation":"The company must demonstrate sustained effectiveness before the weakness can be considered remediated."}],"positive_signals":[{"title":"Rapid profitable growth","severity":"medium","evidence_ids":["EV-002"],"explanation":"2024 revenue grew 60%, while nine-month 2025 revenue grew 47% and GAAP net income remained positive."},{"title":"Asset-light risk model","severity":"medium","evidence_ids":["EV-004"],"explanation":"Insurance carriers retain the underlying policy balance-sheet risk."},{"title":"Strong pro forma liquidity","severity":"medium","evidence_ids":["EV-003"],"explanation":"Pro forma adjusted cash, cash equivalents, and investments were about 198.3 million dollars."}],"contradictions":[{"topic":"Profitability versus cash conversion","evidence_ids":["EV-002","EV-003"],"resolution_status":"accepted_uncertainty","resolution":"GAAP income and Adjusted EBITDA are positive, while 2024 operating cash flow was negative because commissions receivable and other working-capital assets grew."}],"unknowns":["An independent public-company peer benchmark has not been completed.","An external litigation, insurance-licensing, and enforcement-database review has not been completed.","Future issuance from the 2026 Plan and ESPP depends on grants, vesting, and board decisions and is not included in current fully diluted equity value."],"evidence":[{"evidence_id":"EV-001","claim_id":"offering_terms","source_type":"regulatory_filing","source_title":"Ethos final prospectus (424B4)","source_url":"https://www.sec.gov/Archives/edgar/data/1788451/000119312526029993/d901135d424b4.htm","source_version":"Filed 2026-01-30","published_at":"2026-01-30T00:00:00Z","accessed_at":"2026-07-21T09:30:00Z","location":"Prospectus cover","extracted_fact":"Ethos offered 5,127,696 primary Class A shares and selling stockholders offered 5,398,619 shares at 19 dollars per share; Ethos receives no proceeds from the secondary sales.","unit":"shares_and_USD_per_share","confidence":"high","review_status":"verified","quality_flags":[]},{"evidence_id":"EV-002","claim_id":"growth_and_profitability","source_type":"audited_financials","source_title":"Ethos final prospectus (424B4)","source_url":"https://www.sec.gov/Archives/edgar/data/1788451/000119312526029993/d901135d424b4.htm","source_version":"Filed 2026-01-30","published_at":"2026-01-30T00:00:00Z","accessed_at":"2026-07-21T09:30:00Z","location":"Summary financial data and MD&A","extracted_fact":"Revenue rose from 159.754 million dollars in 2023 to 254.926 million dollars in 2024, and nine-month 2025 revenue was 278 million dollars. Net income was 48.832 million dollars in 2024 and 46.590 million dollars for nine months ended September 30, 2025; Adjusted EBITDA was 57.536 million dollars and 63.191 million dollars, respectively.","unit":"USD_millions","confidence":"high","review_status":"verified","quality_flags":["management_defined_metric"]},{"evidence_id":"EV-003","claim_id":"cash_flow_and_liquidity","source_type":"audited_financials","source_title":"Ethos final prospectus (424B4)","source_url":"https://www.sec.gov/Archives/edgar/data/1788451/000119312526029993/d901135d424b4.htm","source_version":"Filed 2026-01-30","published_at":"2026-01-30T00:00:00Z","accessed_at":"2026-07-21T09:30:00Z","location":"Cash flows and pro forma balance sheet","extracted_fact":"Operating cash flow was negative 10.908 million dollars in 2024 and positive 31.281 million dollars for nine months ended September 30, 2025. Pro forma adjusted cash, cash equivalents, and investments were 198.315 million dollars.","unit":"USD_millions","confidence":"high","review_status":"verified","quality_flags":[]},{"evidence_id":"EV-004","claim_id":"asset_light_model","source_type":"regulatory_filing","source_title":"Ethos final prospectus (424B4)","source_url":"https://www.sec.gov/Archives/edgar/data/1788451/000119312526029993/d901135d424b4.htm","source_version":"Filed 2026-01-30","published_at":"2026-01-30T00:00:00Z","accessed_at":"2026-07-21T09:30:00Z","location":"Prospectus Summary — Business Model","extracte